{
  "version": 1,
  "id": "jobcounsel2_sample",
  "title": "(예시) 직업상담사 2급 기초 이론",
  "subject": "직업상담학",
  "page_count": 60,
  "is_sample": true,
  "note": "예시 데이터입니다. 일반적인 직업상담 이론 주제를 바탕으로 만든 샘플이며 시험 대비용으로 검증되지 않았습니다. 페이지 번호도 가상의 값입니다.",
  "updated_at": "2026-10-06T07:00:00+09:00",
  "chunks": [
    {
      "id": "c01",
      "title": "직업상담의 목적과 상담자의 자질",
      "pages": [1, 10],
      "summary": [
        "(예시) 직업상담은 내담자가 자신과 직업세계를 이해하고 합리적인 진로 의사결정을 하도록 돕는 과정이다.",
        "주요 목적: 자기이해 증진, 직업세계 이해, 의사결정 능력 향상, 직업적응 지원.",
        "상담자에게는 공감적 이해, 무조건적 존중, 진실성(일치성) 같은 태도가 중요하다."
      ],
      "questions": [
        {
          "id": "q01",
          "question": "(예시) 다음 중 직업상담의 목적으로 가장 거리가 먼 것은?",
          "choices": [
            "내담자의 자기이해 증진",
            "직업세계에 대한 이해 증진",
            "상담자가 직업을 대신 결정해 주는 것",
            "합리적 의사결정 능력 향상"
          ],
          "answer_index": 2,
          "explanation": "직업상담은 내담자 스스로 결정하도록 돕는 과정이다. 상담자가 대신 결정하는 것은 목적이 아니다.",
          "pages": [2, 4]
        },
        {
          "id": "q02",
          "question": "(예시) 로저스가 강조한 상담자의 태도에 해당하지 않는 것은?",
          "choices": ["공감적 이해", "무조건적 긍정적 존중", "진실성(일치성)", "지시적 해석"],
          "answer_index": 3,
          "explanation": "공감적 이해, 무조건적 긍정적 존중, 진실성은 내담자중심 상담의 핵심 태도이다. 지시적 해석은 해당하지 않는다.",
          "pages": [8, 10]
        }
      ]
    },
    {
      "id": "c02",
      "title": "특성-요인 이론",
      "pages": [11, 20],
      "summary": [
        "(예시) 파슨스(Parsons)에서 출발한 이론으로, 개인의 특성과 직업의 요구 요인을 연결(매칭)하는 것을 강조한다.",
        "3요소: 자기 자신에 대한 이해, 직업세계에 대한 지식, 이 둘의 합리적 연결.",
        "윌리암슨(Williamson)은 상담 과정을 분석-종합-진단-예측(처방)-상담-추수지도로 정리했다."
      ],
      "questions": [
        {
          "id": "q03",
          "question": "(예시) 특성-요인 이론의 핵심 아이디어로 가장 적절한 것은?",
          "choices": [
            "무의식적 욕구가 직업 선택을 결정한다",
            "개인의 특성과 직업의 요구를 합리적으로 연결한다",
            "진로발달은 전 생애에 걸쳐 단계적으로 이루어진다",
            "우연한 사건이 진로를 결정한다"
          ],
          "answer_index": 1,
          "explanation": "특성-요인 이론은 개인 특성(흥미, 적성 등)과 직업 요구 조건의 매칭을 강조한다.",
          "pages": [11, 14]
        },
        {
          "id": "q04",
          "question": "(예시) 윌리암슨의 상담 과정에서 '분석' 다음 단계는?",
          "choices": ["종합", "예측", "상담", "추수지도"],
          "answer_index": 0,
          "explanation": "분석 → 종합 → 진단 → 예측(처방) → 상담 → 추수지도 순서이다.",
          "pages": [17, 20]
        }
      ]
    },
    {
      "id": "c03",
      "title": "홀랜드의 직업성격 유형(RIASEC)",
      "pages": [21, 32],
      "summary": [
        "(예시) 홀랜드는 사람과 환경을 6가지 유형으로 구분했다: 현실형(R), 탐구형(I), 예술형(A), 사회형(S), 진취형(E), 관습형(C).",
        "육각형 모형에서 인접한 유형일수록 유사성이 높고, 마주 보는 유형일수록 차이가 크다.",
        "주요 개념: 일관성, 변별성(차별성), 정체성, 일치성(적합성), 계측성."
      ],
      "questions": [
        {
          "id": "q05",
          "question": "(예시) 홀랜드 육각형 모형에서 사회형(S)과 마주 보는(가장 거리가 먼) 유형은?",
          "choices": ["진취형(E)", "현실형(R)", "예술형(A)", "관습형(C)"],
          "answer_index": 1,
          "explanation": "R-I-A-S-E-C 순서의 육각형에서 사회형(S)의 반대편은 현실형(R)이다.",
          "pages": [24, 27]
        }
      ]
    },
    {
      "id": "c04",
      "title": "수퍼의 생애진로발달 이론",
      "pages": [33, 44],
      "summary": [
        "(예시) 수퍼(Super)는 진로발달을 전 생애에 걸친 과정으로 보고 성장-탐색-확립-유지-쇠퇴 단계를 제시했다.",
        "생애진로무지개(Life-Career Rainbow)로 자녀, 학생, 여가인, 시민, 직업인, 가사인 등 여러 역할을 설명한다.",
        "자아개념이 직업 선택과 발달의 핵심 요인이라고 보았다."
      ],
      "questions": [
        {
          "id": "q06",
          "question": "(예시) 수퍼의 진로발달 단계를 순서대로 바르게 나열한 것은?",
          "choices": [
            "탐색 - 성장 - 확립 - 유지 - 쇠퇴",
            "성장 - 탐색 - 확립 - 유지 - 쇠퇴",
            "성장 - 확립 - 탐색 - 유지 - 쇠퇴",
            "탐색 - 확립 - 성장 - 쇠퇴 - 유지"
          ],
          "answer_index": 1,
          "explanation": "성장기 → 탐색기 → 확립기 → 유지기 → 쇠퇴기 순서이다.",
          "pages": [34, 38]
        }
      ]
    },
    {
      "id": "c05",
      "title": "직업심리검사의 신뢰도와 타당도",
      "pages": [45, 60],
      "summary": [
        "(예시) 신뢰도는 검사 결과가 얼마나 일관되게 나오는지를 뜻한다. 예: 검사-재검사, 동형검사, 내적합치도.",
        "타당도는 검사가 측정하려는 것을 실제로 측정하는지를 뜻한다. 예: 내용, 준거(예언·공인), 구성 타당도.",
        "신뢰도는 타당도의 필요조건이지만 충분조건은 아니다."
      ],
      "questions": [
        {
          "id": "q07",
          "question": "(예시) 같은 검사를 같은 사람에게 시간 간격을 두고 두 번 실시해 구하는 신뢰도는?",
          "choices": ["검사-재검사 신뢰도", "동형검사 신뢰도", "반분 신뢰도", "구성 타당도"],
          "answer_index": 0,
          "explanation": "동일 검사를 시간 간격을 두고 반복 실시하여 두 점수의 상관을 보는 것이 검사-재검사 신뢰도이다.",
          "pages": [46, 50]
        },
        {
          "id": "q08",
          "question": "(예시) 신뢰도와 타당도의 관계로 옳은 것은?",
          "choices": [
            "타당도가 낮으면 신뢰도도 반드시 낮다",
            "신뢰도가 높으면 타당도도 반드시 높다",
            "신뢰도는 타당도의 필요조건이지만 충분조건은 아니다",
            "둘은 서로 관계가 없다"
          ],
          "answer_index": 2,
          "explanation": "일관성(신뢰도)이 없으면 타당할 수 없지만, 일관성이 있다고 해서 원하는 것을 측정한다는 보장은 없다.",
          "pages": [55, 60]
        }
      ]
    }
  ]
}
